film,matrix,sci-fi,neo does some cool stuff,12.63,1998,wackakowsi bros,18,120,paramount
Book,oathbringer,fantasy,the radienst are back and they are pissed,21.36,2017,1254789652,Brandon Sanderson,1235,1.3
book,Animal Farm, fantasy, farming in a rural commnity gets an upset,15.25,1982,4521589632,George Orwell,250,2.6
film,Predator,Documentary,a group fo friends go hiking and find an unexpected guest,14.25,1986,John McTiernan,18,90,fox
book,lord of the rings,fantasy,few lads go ana  trip to return some jewlery tothe shops,18.24,1940,1254785632,JRR Tolkien,1524,6.25
film,Dog Soldiers,horror,few boys from the army go camping with their dogs,8.99,2003,Neill Marshall,18,91,Paramount
